{
  "schema_version": 1,
  "kind": "audio_profile_transition_contract_catalog",
  "manager": "audio-profile-manager-v1",
  "effect_scope": "repository-and-simulation-only",
  "canonical_profile_catalog": {
    "path": "profiles/audio-profiles.v1.json",
    "sha256": "7282efd05b92e6eb326d27befcf00692e77d3bb589e6d828c4557567d12a5ea9"
  },
  "aliases": {},
  "profiles": {
    "desktop-mixed": {
      "devices": ["motu_m2"],
      "source": "system-mix",
      "sink": "motu-m2",
      "midi": "disabled",
      "monitoring": "lake-people-headphones",
      "rate": {"policy": "fixed", "hz": 48000},
      "quantum": {"policy": "fixed", "frames": 1024},
      "resampling": "allowed",
      "dsp": "bypass",
      "channels": {"count": 2, "layout": "stereo"},
      "limits": {"xrun_max": 0, "latency_ms_max": null, "peak_dbfs_max": null},
      "lifecycle": {"start": [], "stop": []},
      "readback": ["active_profile", "default_sink", "rate_hz", "quantum_frames"],
      "rollback": ["active_profile", "default_sink", "rate_hz", "quantum_frames"],
      "managed_routes": [],
      "protects_recording": true
    },
    "reference-listening": {
      "devices": ["motu_m2", "lake_people_g111_mk2", "focal_clear_mg"],
      "source": "playback-applications",
      "sink": "motu-m2",
      "midi": "disabled",
      "monitoring": "lake-people-headphones",
      "rate": {"policy": "measure-before-decision", "hz": null},
      "quantum": {"policy": "fixed", "frames": 1024},
      "resampling": "measure-before-decision",
      "dsp": "bypass",
      "channels": {"count": 2, "layout": "stereo"},
      "limits": {"xrun_max": 0, "latency_ms_max": null, "peak_dbfs_max": null},
      "lifecycle": {"start": [], "stop": []},
      "readback": ["active_profile", "default_sink", "rate_policy", "quantum_frames", "dsp"],
      "rollback": ["active_profile", "default_sink", "rate_policy", "quantum_frames", "dsp"],
      "managed_routes": [],
      "protects_recording": true
    },
    "voice-recording": {
      "devices": ["motu_m2", "rode_nt1a"],
      "source": "motu-m2-input-selected",
      "sink": "motu-m2",
      "midi": "disabled",
      "monitoring": "motu-direct-or-owned-software-monitor",
      "rate": {"policy": "fixed", "hz": 48000},
      "quantum": {"policy": "candidate", "frames": 512},
      "resampling": "forbidden-on-capture",
      "dsp": "recording-chain-bypass-by-default",
      "channels": {"count": 1, "layout": "mono"},
      "limits": {"xrun_max": 0, "latency_ms_max": null, "peak_dbfs_max": -6},
      "lifecycle": {"start": ["audio-recording-guard"], "stop": ["audio-recording-guard"]},
      "readback": ["active_profile", "default_source", "default_sink", "rate_hz", "quantum_frames", "managed_services"],
      "rollback": ["active_profile", "default_source", "default_sink", "rate_hz", "quantum_frames", "managed_services"],
      "managed_routes": ["voice-capture-to-owned-recording-bus"],
      "protects_recording": true
    },
    "piano-digital-recording": {
      "devices": ["motu_m2", "roland_fp_30x"],
      "source": "roland-usb-audio",
      "sink": "motu-m2",
      "midi": "capture",
      "monitoring": "lake-people-headphones",
      "rate": {"policy": "single-stage-resample-to-core", "hz": 48000},
      "quantum": {"policy": "candidate", "frames": 512},
      "resampling": "roland-44100-to-core-48000-once",
      "dsp": "bypass",
      "channels": {"count": 2, "layout": "stereo"},
      "limits": {"xrun_max": 0, "latency_ms_max": null, "peak_dbfs_max": -6},
      "lifecycle": {"start": ["audio-recording-guard"], "stop": ["audio-recording-guard"]},
      "readback": ["active_profile", "default_sink", "rate_hz", "quantum_frames", "midi", "managed_routes"],
      "rollback": ["active_profile", "default_sink", "rate_hz", "quantum_frames", "midi", "managed_routes"],
      "managed_routes": ["roland-audio-to-owned-recording-bus", "roland-midi-to-owned-capture"],
      "protects_recording": true
    },
    "piano-software-live": {
      "devices": ["motu_m2", "roland_fp_30x", "focal_clear_mg"],
      "source": "software-instrument-host",
      "sink": "motu-m2",
      "midi": "controller",
      "monitoring": "owned-software-monitor",
      "rate": {"policy": "fixed", "hz": 48000},
      "quantum": {"policy": "candidate", "frames": 128},
      "resampling": "forbidden-in-owned-live-path",
      "dsp": "managed-instrument-chain",
      "channels": {"count": 2, "layout": "stereo"},
      "limits": {"xrun_max": 0, "latency_ms_max": 15, "peak_dbfs_max": -3},
      "lifecycle": {"start": ["audio-software-instrument-host"], "stop": ["audio-software-instrument-host"]},
      "readback": ["active_profile", "default_sink", "rate_hz", "quantum_frames", "midi", "managed_services", "managed_routes"],
      "rollback": ["active_profile", "default_sink", "rate_hz", "quantum_frames", "midi", "managed_services", "managed_routes"],
      "managed_routes": ["roland-midi-to-owned-instrument-host", "owned-instrument-host-to-motu"],
      "protects_recording": true
    },
    "receiver": {
      "devices": ["pioneer_vsx_830_k"],
      "source": "playback-applications",
      "sink": "pioneer-defined-stereo-input",
      "midi": "disabled",
      "monitoring": "receiver",
      "rate": {"policy": "receiver-measured", "hz": null},
      "quantum": {"policy": "safe-baseline", "frames": 1024},
      "resampling": "measure-before-decision",
      "dsp": "receiver-mode-explicit",
      "channels": {"count": 2, "layout": "stereo-until-surround-tested"},
      "limits": {"xrun_max": 0, "latency_ms_max": null, "peak_dbfs_max": null},
      "lifecycle": {"start": [], "stop": []},
      "readback": ["active_profile", "default_sink", "rate_policy", "channels", "dsp"],
      "rollback": ["active_profile", "default_sink", "rate_policy", "channels", "dsp"],
      "managed_routes": [],
      "protects_recording": true
    },
    "bluetooth-convenience": {
      "devices": ["1mii_b03_pro"],
      "source": "playback-applications",
      "sink": "paired-bluetooth-target",
      "midi": "disabled",
      "monitoring": "bluetooth-convenience",
      "rate": {"policy": "codec-negotiated", "hz": null},
      "quantum": {"policy": "safe-baseline", "frames": 1024},
      "resampling": "codec-managed",
      "dsp": "bypass",
      "channels": {"count": 2, "layout": "stereo"},
      "limits": {"xrun_max": null, "latency_ms_max": null, "peak_dbfs_max": null},
      "lifecycle": {"start": [], "stop": []},
      "readback": ["active_profile", "default_sink", "rate_policy", "monitoring"],
      "rollback": ["active_profile", "default_sink", "rate_policy", "monitoring"],
      "managed_routes": [],
      "protects_recording": true
    },
    "qobuz-exclusive": {
      "devices": ["motu_m2", "lake_people_g111_mk2", "focal_clear_mg"],
      "source": "qobuz-adapter-exclusive",
      "sink": "motu-m2-exclusive-candidate",
      "midi": "disabled",
      "monitoring": "lake-people-headphones",
      "rate": {"policy": "track-native-if-proven", "hz": null},
      "quantum": {"policy": "safe-baseline", "frames": 1024},
      "resampling": "forbidden-if-exclusive-proof-passes",
      "dsp": "bypass",
      "channels": {"count": 2, "layout": "stereo"},
      "limits": {"xrun_max": 0, "latency_ms_max": null, "peak_dbfs_max": null},
      "lifecycle": {"start": ["audio-qobuz-exclusive-session"], "stop": ["audio-qobuz-exclusive-session"]},
      "readback": ["active_profile", "default_sink", "rate_policy", "managed_services"],
      "rollback": ["active_profile", "default_sink", "rate_policy", "managed_services"],
      "managed_routes": ["qobuz-exclusive-to-motu"],
      "protects_recording": true
    },
    "experimental": {
      "devices": ["motu_m2", "roland_fp_30x"],
      "source": "managed-plugin-host",
      "sink": "motu-m2",
      "midi": "controller",
      "monitoring": "owned-software-monitor",
      "rate": {"policy": "fixed", "hz": 48000},
      "quantum": {"policy": "safe-baseline", "frames": 1024},
      "resampling": "allowed-inside-owned-host",
      "dsp": "managed-experimental-chain",
      "channels": {"count": 2, "layout": "stereo"},
      "limits": {"xrun_max": 0, "latency_ms_max": null, "peak_dbfs_max": -3},
      "lifecycle": {"start": ["audio-managed-plugin-host"], "stop": ["audio-managed-plugin-host"]},
      "readback": ["active_profile", "default_sink", "rate_hz", "quantum_frames", "midi", "managed_services", "managed_routes"],
      "rollback": ["active_profile", "default_sink", "rate_hz", "quantum_frames", "midi", "managed_services", "managed_routes"],
      "managed_routes": ["roland-midi-to-owned-plugin-host", "owned-plugin-host-to-motu"],
      "protects_recording": true
    },
    "production": {
      "devices": ["motu_m2", "roland_fp_30x", "rode_nt1a", "lake_people_g111_mk2", "focal_clear_mg"],
      "source": "audio-production-mix",
      "sink": "motu-m2",
      "midi": "capture-and-controller",
      "monitoring": "owned-production-monitor",
      "rate": {"policy": "fixed-core", "hz": 48000},
      "quantum": {"policy": "candidate", "frames": 512},
      "resampling": "roland-44100-to-core-48000-once",
      "dsp": "ardour-owned-production-chain",
      "channels": {"count": 2, "layout": "stereo"},
      "limits": {"xrun_max": 0, "latency_ms_max": null, "peak_dbfs_max": -3},
      "lifecycle": {"start": ["audio-production-mix", "ardour-session"], "stop": ["ardour-session", "audio-production-mix"]},
      "readback": ["active_profile", "default_source", "default_sink", "rate_hz", "quantum_frames", "midi", "managed_services", "managed_routes"],
      "rollback": ["active_profile", "default_source", "default_sink", "rate_hz", "quantum_frames", "midi", "managed_services", "managed_routes"],
      "managed_routes": ["voice-to-owned-production-bus", "roland-audio-to-owned-production-bus", "roland-midi-to-ardour", "ardour-to-motu"],
      "protects_recording": true
    }
  }
}
